{
  "schemaVersion": 1,
  "seedVersion": "2026-08-28.1",
  "categories": [
    {
      "id": "food",
      "name": "Food",
      "order": 10
    },
    {
      "id": "gear",
      "name": "Gear",
      "order": 20
    },
    {
      "id": "clothes",
      "name": "Clothes",
      "order": 30
    },
    {
      "id": "hygiene-first-aid",
      "name": "Hygiene & First Aid",
      "order": 40
    },
    {
      "id": "extras",
      "name": "Extras",
      "order": 50
    }
  ],
  "items": [
    {
      "id": "food-eggs",
      "name": "Eggs",
      "category": "food",
      "section": "Breakfast",
      "defaultQuantity": 1,
      "unit": "item",
      "tripStyles": [
        "car",
        "light-backpacking",
        "custom"
      ],
      "tags": [
        "food"
      ],
      "aliases": [],
      "archived": false,
      "source": "seed"
    },
    {
      "id": "food-bacon",
      "name": "Bacon",
      "category": "food",
      "section": "Breakfast",
      "defaultQuantity": 1,
      "unit": "pack",
      "tripStyles": [
        "car",
        "light-backpacking",
        "custom"
      ],
      "tags": [
        "food"
      ],
      "aliases": [],
      "archived": false,
      "source": "seed"
    },
    {
      "id": "food-sausage",
      "name": "Sausage",
      "category": "food",
      "section": "Breakfast",
      "defaultQuantity": 1,
      "unit": "pack",
      "tripStyles": [
        "car",
        "light-backpacking",
        "custom"
      ],
      "tags": [
        "food"
      ],
      "aliases": [],
      "archived": false,
      "source": "seed"
    },
    {
      "id": "food-pancake-mix",
      "name": "Pancake Mix",
      "category": "food",
      "section": "Breakfast",
      "defaultQuantity": 1,
      "unit": "box",
      "tripStyles": [
        "car",
        "light-backpacking",
        "custom"
      ],
      "tags": [
        "food"
      ],
      "aliases": [],
      "archived": false,
      "source": "seed"
    },
    {
      "id": "food-syrup",
      "name": "Syrup",
      "category": "food",
      "section": "Breakfast",
      "defaultQuantity": 1,
      "unit": "bottle",
      "tripStyles": [
        "car",
        "light-backpacking",
        "custom"
      ],
      "tags": [
        "food"
      ],
      "aliases": [],
      "archived": false,
      "source": "seed"
    },
    {
      "id": "food-oatmeal",
      "name": "Oatmeal",
      "category": "food",
      "section": "Breakfast",
      "defaultQuantity": 1,
      "unit": "pack",
      "tripStyles": [
        "car",
        "light-backpacking",
        "custom"
      ],
      "tags": [
        "food"
      ],
      "aliases": [],
      "archived": false,
      "source": "seed"
    },
    {
      "id": "food-breakfast-bars",
      "name": "Breakfast Bars",
      "category": "food",
      "section": "Breakfast",
      "defaultQuantity": 1,
      "unit": "box",
      "tripStyles": [
        "car",
        "light-backpacking",
        "custom"
      ],
      "tags": [
        "food"
      ],
      "aliases": [],
      "archived": false,
      "source": "seed"
    },
    {
      "id": "food-bread",
      "name": "Bread",
      "category": "food",
      "section": "Lunch",
      "defaultQuantity": 1,
      "unit": "loaf",
      "tripStyles": [
        "car",
        "light-backpacking",
        "custom"
      ],
      "tags": [
        "food"
      ],
      "aliases": [],
      "archived": false,
      "source": "seed"
    },
    {
      "id": "food-deli-meat",
      "name": "Deli Meat",
      "category": "food",
      "section": "Lunch",
      "defaultQuantity": 1,
      "unit": "pack",
      "tripStyles": [
        "car",
        "light-backpacking",
        "custom"
      ],
      "tags": [
        "food"
      ],
      "aliases": [],
      "archived": false,
      "source": "seed"
    },
    {
      "id": "food-cheese",
      "name": "Cheese",
      "category": "food",
      "section": "Lunch",
      "defaultQuantity": 1,
      "unit": "pack",
      "tripStyles": [
        "car",
        "light-backpacking",
        "custom"
      ],
      "tags": [
        "food"
      ],
      "aliases": [],
      "archived": false,
      "source": "seed"
    },
    {
      "id": "food-wraps",
      "name": "Wraps / Tortillas",
      "category": "food",
      "section": "Lunch",
      "defaultQuantity": 1,
      "unit": "pack",
      "tripStyles": [
        "car",
        "light-backpacking",
        "custom"
      ],
      "tags": [
        "food"
      ],
      "aliases": [],
      "archived": false,
      "source": "seed"
    },
    {
      "id": "food-burgers",
      "name": "Burgers",
      "category": "food",
      "section": "Dinner",
      "defaultQuantity": 1,
      "unit": "pack",
      "tripStyles": [
        "car",
        "light-backpacking",
        "custom"
      ],
      "tags": [
        "food"
      ],
      "aliases": [],
      "archived": false,
      "source": "seed"
    },
    {
      "id": "food-hot-dogs",
      "name": "Hot Dogs",
      "category": "food",
      "section": "Dinner",
      "defaultQuantity": 1,
      "unit": "pack",
      "tripStyles": [
        "car",
        "light-backpacking",
        "custom"
      ],
      "tags": [
        "food"
      ],
      "aliases": [],
      "archived": false,
      "source": "seed"
    },
    {
      "id": "food-buns",
      "name": "Buns",
      "category": "food",
      "section": "Dinner",
      "defaultQuantity": 1,
      "unit": "pack",
      "tripStyles": [
        "car",
        "light-backpacking",
        "custom"
      ],
      "tags": [
        "food"
      ],
      "aliases": [],
      "archived": false,
      "source": "seed"
    },
    {
      "id": "food-camp-meal",
      "name": "Camp Meal",
      "category": "food",
      "section": "Dinner",
      "defaultQuantity": 1,
      "unit": "meal",
      "tripStyles": [
        "car",
        "light-backpacking",
        "custom"
      ],
      "tags": [
        "food"
      ],
      "aliases": [],
      "archived": false,
      "source": "seed"
    },
    {
      "id": "food-chips",
      "name": "Chips",
      "category": "food",
      "section": "Snacks",
      "defaultQuantity": 1,
      "unit": "bag",
      "tripStyles": [
        "car",
        "light-backpacking",
        "custom"
      ],
      "tags": [
        "food"
      ],
      "aliases": [],
      "archived": false,
      "source": "seed"
    },
    {
      "id": "food-trail-mix",
      "name": "Trail Mix",
      "category": "food",
      "section": "Snacks",
      "defaultQuantity": 1,
      "unit": "bag",
      "tripStyles": [
        "car",
        "light-backpacking",
        "custom"
      ],
      "tags": [
        "food"
      ],
      "aliases": [],
      "archived": false,
      "source": "seed"
    },
    {
      "id": "food-jerky",
      "name": "Jerky",
      "category": "food",
      "section": "Snacks",
      "defaultQuantity": 1,
      "unit": "bag",
      "tripStyles": [
        "car",
        "light-backpacking",
        "custom"
      ],
      "tags": [
        "food"
      ],
      "aliases": [],
      "archived": false,
      "source": "seed"
    },
    {
      "id": "food-granola-bars",
      "name": "Granola Bars",
      "category": "food",
      "section": "Snacks",
      "defaultQuantity": 1,
      "unit": "box",
      "tripStyles": [
        "car",
        "light-backpacking",
        "custom"
      ],
      "tags": [
        "food"
      ],
      "aliases": [],
      "archived": false,
      "source": "seed"
    },
    {
      "id": "food-marshmallows",
      "name": "Marshmallows",
      "category": "food",
      "section": "Snacks",
      "defaultQuantity": 1,
      "unit": "bag",
      "tripStyles": [
        "car",
        "light-backpacking",
        "custom"
      ],
      "tags": [
        "food"
      ],
      "aliases": [],
      "archived": false,
      "source": "seed"
    },
    {
      "id": "food-water",
      "name": "Drinking Water",
      "category": "food",
      "section": "Drinks",
      "defaultQuantity": 1,
      "unit": "gallon",
      "tripStyles": [
        "car",
        "light-backpacking",
        "custom"
      ],
      "tags": [
        "food"
      ],
      "aliases": [],
      "archived": false,
      "source": "seed"
    },
    {
      "id": "food-coffee",
      "name": "Coffee",
      "category": "food",
      "section": "Drinks",
      "defaultQuantity": 1,
      "unit": "pack",
      "tripStyles": [
        "car",
        "light-backpacking",
        "custom"
      ],
      "tags": [
        "food"
      ],
      "aliases": [],
      "archived": false,
      "source": "seed"
    },
    {
      "id": "food-tea",
      "name": "Tea",
      "category": "food",
      "section": "Drinks",
      "defaultQuantity": 1,
      "unit": "pack",
      "tripStyles": [
        "car",
        "light-backpacking",
        "custom"
      ],
      "tags": [
        "food"
      ],
      "aliases": [],
      "archived": false,
      "source": "seed"
    },
    {
      "id": "food-drink-mix",
      "name": "Drink Mix",
      "category": "food",
      "section": "Drinks",
      "defaultQuantity": 1,
      "unit": "pack",
      "tripStyles": [
        "car",
        "light-backpacking",
        "custom"
      ],
      "tags": [
        "food"
      ],
      "aliases": [],
      "archived": false,
      "source": "seed"
    },
    {
      "id": "food-mayo",
      "name": "Mayonnaise",
      "category": "food",
      "section": "Condiments",
      "defaultQuantity": 1,
      "unit": "bottle",
      "tripStyles": [
        "car",
        "light-backpacking",
        "custom"
      ],
      "tags": [
        "food"
      ],
      "aliases": [],
      "archived": false,
      "source": "seed"
    },
    {
      "id": "food-ketchup",
      "name": "Ketchup",
      "category": "food",
      "section": "Condiments",
      "defaultQuantity": 1,
      "unit": "bottle",
      "tripStyles": [
        "car",